intent,text
visimisi,"Tolong berikan informasi terkait visi dan misi di universitas klabat."
visimisi,"Saya ingin mengetahui visi dan misi yang dipegang oleh universitas klabat."
visimisi,"Apakah universitas klabat memiliki visi dan misi yang jelas?"
visimisi,"Mohon berikan detail visi dan misi universitas klabat."
visimisi,"Siapa yang bisa saya hubungi untuk mendapatkan informasi tentang visi dan misi di universitas klabat?"
visimisi,"Apakah ada kontak yang bisa saya hubungi untuk menanyakan tentang visi dan misi universitas klabat?"
visimisi,"Bagaimana cara mendapatkan informasi tentang visi dan misi di universitas klabat?"
visimisi,"apakah unklab memiliki visi yang jelas?"
scholarship,"saya mau scholarship beasiswa di unklab?"
scholarship,"apakah unklab memiliki program beasiswa luar negeri?"
scholarship,"apakah unklab memiliki program beasiswa?"
scholarship,"Apakah di unklab ada program studi magister?"
scholarship,"apakah ada program master di unklab?"
scholarship,"apakah di unklab ada beasiswa?"
scholarship,"apakah di unklab ada beasiswa untuk mahasiswa baru?"
scholarship,"apakah di unklab ada beasiswa prestasi?"
scholarship,"apakah di unklab ada beasiswa untuk mahasiswa?"
scholarship,"apakah ada beasiswa prestasi di unklab?"
scholarship,"apakah ada beasiswa di unklab?"
scholarship,"bagaimana cara untuk mendaftar beasiswa di unklab?"
scholarship,"Apakah universitas klabat menyediakan program beasiswa?"
scholarship,"Tolong informasikan tentang beasiswa yang tersedia di universitas klabat."
scholarship,"Saya ingin tahu lebih banyak tentang program beasiswa di universitas klabat."
scholarship,"Apakah ada informasi mengenai beasiswa yang ditawarkan oleh universitas klabat?"
scholarship,"Mohon berikan rincian tentang program beasiswa di universitas klabat."
scholarship,"Bagaimana cara mendapatkan informasi tentang beasiswa di universitas klabat?"
scholarship,"Siapa yang dapat memberikan informasi tentang beasiswa di universitas klabat?"
scholarship,"Bolehkah saya menanyakan tentang program beasiswa di universitas klabat?"
scholarship,"Tolong berikan informasi terkait beasiswa yang tersedia di universitas klabat."
scholarship,"Saya ingin mengetahui jenis-jenis beasiswa yang ada di universitas klabat."
scholarship,"Apakah universitas klabat memiliki informasi mengenai persyaratan beasiswa?"
scholarship,"Mohon berikan detail tentang program beasiswa di universitas klabat."
scholarship,"Siapa yang bisa saya hubungi untuk mendapatkan informasi tentang beasiswa di universitas klabat?"
scholarship,"Apakah ada kontak yang bisa saya hubungi untuk menanyakan informasi beasiswa di universitas klabat?"
scholarship,"Bagaimana cara mendapatkan formulir pendaftaran beasiswa di universitas klabat?"
scholarship,"saya mau menfatar di unklab. apakah ada beasiswa?"
asmi,"apakah ada fakultas jurusan sekertaris di unklab?"
asmi,"berikan saya sekit informasi tentang jurusan sekertaris?"
asmi,"saya mau masuk jurusan sekertaris di unklab."
asmi,"ASMI"
asmi,"ASMI unklab?"
asmi,"apa itu ASMI unklab?"
asmi,"apa itu ASMI?"
asmi,"apa kepanjangan ASMI?"
asmi,"apa kepanjangan ASMI di unklab?"
asmi,"apa kepanjangan dari ASMI di universitas klabat?"
asmi,"latar belakang dari program studi asmi?"
asmi,"siapa dekan di program studi asmi?"
asmi,"siapa dekan di fakultas asmi?"
asmi,"siapa dekan di asmi?"
asmi,"siapa dekan di asmi unklab?"
asmi,"siapa dekan di asmi universitas klabat?"
asmi,"dekan di asmi universitas klabat?"
asmi,"siapa dekan dari prodi asmi atau Akademi Sekretari Manajemen Indonesia?"
asmi,"Apakah universitas klabat memiliki program studi Sekretari Manajemen Indonesia (ASMI)?"
asmi,"Tolong informasikan tentang program studi Sekretari Manajemen Indonesia di universitas klabat."
asmi,"Saya ingin tahu lebih banyak tentang program studi ASMI di universitas klabat."
asmi,"Apakah ada informasi mengenai program studi Sekretari Manajemen Indonesia di universitas klabat?"
asmi,"Mohon berikan rincian tentang program studi ASMI di universitas klabat."
asmi,"Bagaimana cara mendaftar ke program studi Sekretari Manajemen Indonesia di universitas klabat?"
asmi,"Siapa yang dapat memberikan informasi tentang program studi ASMI di universitas klabat?"
asmi,"Bolehkah saya menanyakan tentang program studi Sekretari Manajemen Indonesia di universitas klabat?"
asmi,"Tolong berikan informasi terkait program studi ASMI di universitas klabat."
asmi,"Saya ingin mengetahui kurikulum yang ditawarkan oleh program studi Sekretari Manajemen Indonesia di universitas klabat."
asmi,"Apakah universitas klabat memiliki informasi mengenai prospek karir lulusan program studi ASMI?"
asmi,"Mohon berikan detail tentang program studi Sekretari Manajemen Indonesia di universitas klabat."
asmi,"Siapa yang bisa saya hubungi untuk mendapatkan informasi tentang program studi ASMI di universitas klabat?"
asmi,"Apakah ada kontak yang bisa saya hubungi untuk menanyakan informasi program studi Sekretari Manajemen Indonesia di universitas klabat?"
asmi,"Bagaimana cara mendapatkan brosur atau informasi lebih lanjut tentang program studi ASMI di universitas klabat?"
asmi,"Apa saja materi kuliah yang diajarkan dalam program studi Sekretari Manajemen Indonesia di universitas klabat?"
asmi,"Apakah ada kegiatan ekstrakurikuler yang terkait dengan program studi ASMI di universitas klabat?"
asmi,"Apakah program studi Sekretari Manajemen Indonesia di universitas klabat terakreditasi?"
asmi,"Apakah ada beasiswa khusus untuk mahasiswa program studi ASMI di universitas klabat?"
asmi,"Berapa lama masa studi dalam program studi Sekretari Manajemen Indonesia di universitas klabat?"
asmi,"Apakah ada kerja praktik atau magang yang diwajibkan dalam program studi ASMI di universitas klabat?"
asmi,"apa visi dan misi dari jurusan sekretaris?"
asmi,"apakah benar adalah dekan asmi?"
ekonomi,"UBS"
ekonomi,"UBS unklab"
ekonomi,"apa yang dimaksud dengan UBS?"
ekonomi,"apa yang dimaksud dengan feb unklab?"
ekonomi,"feb"
ekonomi,"feb unklab"
ekonomi,"apa itu feb?"
ekonomi,"apa itu fakultas ekonomi?"
ekonomi,"berikan saya sekit informasi tentang fakultas ekonomi dan bisnis?"
ekonomi,"ceritakan sedikit tentang fakultas ekonomi unklab?"
ekonomi,"apa kepanjangan dari FEB di unklab?"
ekonomi,"apa kepanjangan dari FEB di universitas klabat?"
ekonomi,"apa kepanjangan FEB?"
ekonomi,"siapa dekan di FEB atau fakultas ekonomi?"
ekonomi,"apa kepanjangan UBS?"
ekonomi,"apa kepanjangan dari UBS?"
ekonomi,"apa kepanjangan dari UBS di universitas klabat?"
ekonomi,"latar belakang dari program di fakultas ekonomi dan bisnis?"
ekonomi,"siapa dekan di fakultas ekonomi dan bisnis?"
ekonomi,"siapa dekan di fakultas ekonomi unklab?"
ekonomi,"dekan di fakultas ekonomi?"
ekonomi,"dekan di feb?"
ekonomi,"Apakah universitas klabat memiliki fakultas ekonomi dan Bisnis?"
ekonomi,"Tolong informasikan tentang fakultas ekonomi dan Bisnis di universitas klabat."
ekonomi,"Saya ingin tahu lebih banyak tentang fakultas ekonomi dan Bisnis di universitas klabat."
ekonomi,"Apakah ada informasi mengenai fakultas ekonomi dan Bisnis di universitas klabat?"
ekonomi,"Mohon berikan rincian tentang fakultas ekonomi dan Bisnis di universitas klabat."
ekonomi,"Bagaimana cara mendaftar ke fakultas ekonomi dan Bisnis di universitas klabat?"
ekonomi,"Siapa yang dapat memberikan informasi tentang fakultas ekonomi dan Bisnis di universitas klabat?"
ekonomi,"Bolehkah saya menanyakan tentang fakultas ekonomi dan Bisnis di universitas klabat?"
ekonomi,"Tolong berikan informasi terkait fakultas ekonomi dan Bisnis di universitas klabat."
ekonomi,"Saya ingin mengetahui program studi yang ada di fakultas ekonomi dan Bisnis di universitas klabat."
ekonomi,"Apakah universitas klabat memiliki informasi mengenai prospek karir lulusan fakultas ekonomi dan Bisnis?"
ekonomi,"Mohon berikan detail tentang fakultas ekonomi dan Bisnis di universitas klabat."
ekonomi,"Siapa yang bisa saya hubungi untuk mendapatkan informasi tentang fakultas ekonomi dan Bisnis di universitas klabat?"
ekonomi,"Apakah ada kontak yang bisa saya hubungi untuk menanyakan informasi fakultas ekonomi dan Bisnis di universitas klabat?"
ekonomi,"Bagaimana cara mendapatkan brosur atau informasi lebih lanjut tentang fakultas ekonomi dan Bisnis di universitas klabat?"
ekonomi,"Siapa dekan dari fakultas ekonomi dan Bisnis di universitas klabat?"
ekonomi,"Apakah ada beasiswa khusus untuk mahasiswa fakultas ekonomi dan Bisnis di universitas klabat?"
ekonomi,"Berapa lama masa studi dalam fakultas ekonomi dan Bisnis di universitas klabat?"
ekonomi,"Apakah ada kerja praktik atau magang yang diwajibkan dalam fakultas ekonomi dan Bisnis di universitas klabat?"
ekonomi,"siapa saja dosen di fakultas ekonomi?"
ekonomi,"siapa saja dosen di FEB?"
ekonomi,"apa visi dan misi dari fakultas ekonomi?"
ekonomi,"apa visi dan misi fakultas feb?"
ekonomi,"apakah benar adalah dekan fakultas ekonomi?"
filsafat,"fakultas filsafat"
filsafat,"fakultas filsafat adalah"
filsafat,"apa itu fakultas filsafat?"
filsafat,"berikan saya sekit informasi tentang fakultas filsafat?"
filsafat,"fakultas fisafat adalah?"
filsafat,"ceritakan sedikit tentang fakultas filsafat?"
filsafat,"fakultas fisafat mengajarkan tentang apa?"
filsafat,"fakultas fisafat unklab belajar tentang apa?"
filsafat,"apa kepanjangan dari ffil di unklab?"
filsafat,"apa kepanjangan ffil?"
filsafat,"latar belakang dari fakultas filsafat?"
filsafat,"siapa dekan dari fakultas filsafat?"
filsafat,"siapa dekan filsafat?"
filsafat,"dekan di fakultas filsafat?"
filsafat,"siapa dekan fakultas filsafat?"
filsafat,"siapa saja dosen di fakultas filsafat?"
filsafat,"Apakah universitas klabat memiliki fakultas Filsafat?"
filsafat,"Tolong informasikan tentang fakultas Filsafat di universitas klabat."
filsafat,"Saya ingin tahu lebih banyak tentang fakultas Filsafat di universitas klabat."
filsafat,"Apakah ada informasi mengenai fakultas Filsafat di universitas klabat?"
filsafat,"Mohon berikan rincian tentang fakultas Filsafat di universitas klabat."
filsafat,"Bagaimana cara mendaftar ke fakultas Filsafat di universitas klabat?"
filsafat,"Siapa yang dapat memberikan informasi tentang fakultas Filsafat di universitas klabat?"
filsafat,"Bolehkah saya menanyakan tentang fakultas Filsafat di universitas klabat?"
filsafat,"Tolong berikan informasi terkait fakultas Filsafat di universitas klabat."
filsafat,"Saya ingin mengetahui program studi yang ada di fakultas Filsafat di universitas klabat."
filsafat,"Apakah universitas klabat memiliki informasi mengenai prospek karir lulusan fakultas Filsafat?"
filsafat,"Mohon berikan detail tentang fakultas Filsafat di universitas klabat."
filsafat,"Siapa yang bisa saya hubungi untuk mendapatkan informasi tentang fakultas Filsafat di universitas klabat?"
filsafat,"Apakah ada kontak yang bisa saya hubungi untuk menanyakan informasi fakultas Filsafat di universitas klabat?"
filsafat,"Bagaimana cara mendapatkan brosur atau informasi lebih lanjut tentang fakultas Filsafat di universitas klabat?"
filsafat,"Siapa dekan dari fakultas Filsafat di universitas klabat?"
filsafat,"Apakah ada beasiswa khusus untuk mahasiswa fakultas Filsafat di universitas klabat?"
filsafat,"Berapa lama masa studi dalam fakultas Filsafat di universitas klabat?"
filsafat,"Apakah ada kerja praktik atau magang yang diwajibkan dalam fakultas Filsafat di universitas klabat?"
filsafat,"apa visi dan misi dari fakultas filsafat?"
fisafat,"apakah benar adalah dekan fakultas filsafat?"
filkom,"fik"
filkom,"filkom"
filkom,"fakultas ilmu komputer"
filkom,"informatika"
filkom,"sistem informasi"
filkom,"teknik informatika"
filkom,"filkom unklab"
filkom,"apa itu filkom?"
filkom,"apa kepanjangan dari filkom di unklab?"
filkom,"apa kepanjangan filkom?"
filkom,"kepanjangan fik?"
filkom,"kepanjangan filkom?"
filkom,"apa kepanjangan filkom di unklab?"
filkom,"apa kepanjangan filkom di universitas klabat?"
filkom,"berikan saya sekit informasi tentang fakultas komputer?"
filkom,"apa itu fakultas ilmu komputer?"
filkom,"ceritakan sedikit tentang fakultas komputer?"
filkom,"di fakultas ilmu komputer kita belajar tentang apa?"
filkom,"apa ilmu yang didapat dari fakultas ilmu komputer?"
filkom,"lulus dari fakultas komputer kita jadi apa?"
filkom,"fakultas ilmu komputer atau filkom mengajar apa?"
filkom,"apa saja yang ditawarkan filkom unklab?"
filkom,"apa latar belakang dari fakultas ilmu komputer?"
filkom,"siapa dekan dari fakultas ilmu komputer atau filkom?"
filkom,"siapa dekan komputer?"
filkom,"siapa dekan filkom?"
filkom,"siapa dekan fakultas filkom?"
filkom,"siapa ya dekan fakultas filkom?"
filkom,"siapa dekan filkom?"
filkom,"dekan filkom?"
filkom,"siapa kaprodi informatika filkom?"
filkom,"siapa kaprodi sistem informasi filkom?"
filkom,"siapa kepala prodi informatika filkom?"
filkom,"siapa kepala prodi sistem informasi filkom?"
filkom,"siapa kepala prodi informatika dari fakultas ilmu komputer?"
filkom,"siapa kepala prodi sistem informasi dari fakultas ilmu komputer?"
filkom,"siapa ya dekan fakultas ilmu komputer?"
filkom,"siapa saja dosen di fakultas ilmu komputer?"
filkom,"Apakah universitas klabat memiliki fakultas ilmu Komputer atau Filkom?"
filkom,"Tolong informasikan tentang fakultas ilmu Komputer atau Filkom di universitas klabat."
filkom,"Saya ingin tahu lebih banyak tentang fakultas ilmu Komputer atau Filkom di universitas klabat."
filkom,"Apakah ada informasi mengenai fakultas ilmu Komputer atau Filkom di universitas klabat?"
filkom,"Mohon berikan rincian tentang fakultas ilmu Komputer atau Filkom di universitas klabat."
filkom,"Bagaimana cara mendaftar ke fakultas ilmu Komputer atau Filkom di universitas klabat?"
filkom,"Siapa yang dapat memberikan informasi tentang fakultas ilmu Komputer atau Filkom di universitas klabat?"
filkom,"Bolehkah saya menanyakan tentang fakultas ilmu Komputer atau Filkom di universitas klabat?"
filkom,"Tolong berikan informasi terkait fakultas ilmu Komputer atau Filkom di universitas klabat."
filkom,"Saya ingin mengetahui program studi yang ada di fakultas ilmu Komputer atau Filkom di universitas klabat."
filkom,"Apakah universitas klabat memiliki informasi mengenai prospek karir lulusan fakultas ilmu Komputer atau Filkom?"
filkom,"Mohon berikan detail tentang fakultas ilmu Komputer atau Filkom di universitas klabat."
filkom,"Siapa yang bisa saya hubungi untuk mendapatkan informasi tentang fakultas ilmu Komputer atau Filkom di universitas klabat?"
filkom,"Tolong berikan informasi tentang fakultas ilmu komputer?"
filkom,"Apakah ada kontak yang bisa saya hubungi untuk menanyakan informasi fakultas ilmu Komputer atau Filkom di universitas klabat?"
filkom,"Bagaimana cara mendapatkan brosur atau informasi lebih lanjut tentang fakultas ilmu Komputer atau Filkom di universitas klabat?"
filkom,"Siapa dekan dari fakultas ilmu Komputer atau Filkom di universitas klabat?"
filkom,"Apakah ada beasiswa khusus untuk mahasiswa fakultas ilmu Komputer atau Filkom di universitas klabat?"
filkom,"Berapa lama masa studi dalam fakultas ilmu Komputer atau Filkom di universitas klabat?"
filkom,"Apakah ada kerja praktik atau magang yang diwajibkan dalam fakultas ilmu Komputer atau Filkom di universitas klabat?"
filkom,"apa visi dan misi fakultas ilmu komputer?"
filkom,"student di Program Studi Informatika dapat berprofesi menjadi apa?"
filkom,"student di Program Studi sistem informasi dapat berprofesi menjadi apa?"
filkom,"apa visi dan misi dari fakultas ilmu komputer?"
filkom,"apa visi dan misi dari filkom?"
filkom,"ada berapa prodi di fakultas ilmu komputer?"
filkom,"ada berapa prodi di filkom?"
filkom,"apakah benar adalah dekan fakultas ilmu komputer?"
filkom,"apakah benar adalah dekan filkom?"
fkip,"fkip"
fkip,"fkip unklab"
fkip,"apa itu fkip?"
fkip,"apa kepanjangan fkip?"
fkip,"apa kepanjangan dari fkip di unklab?"
fkip,"fakultas keguruan"
fkip,"fakultas keguruan dan ilmu pendidikan"
fkip,"apa itu fakultas keguruan?"
fkip,"ceritakan sedikit tentang fakultas keguruan dan ilmu pendidikan?"
fkip,"latar belakang dari fakultas fakultas Keguruan & ilmu Pendidikan (FKIP)?"
fkip,"siapa dekan di fakultas keguruan?"
fkip,"siapa ya dekan di fakultas keguruan?"
fkip,"siapa dekan di fakultas keguruan unklab?"
fkip,"siapa dekan di fakultas keguruan universitas klabat?"
fkip,"dekan fakultas keguruan?"
fkip,"siapa dekan dari fakultas fakultas Keguruan & ilmu Pendidikan (FKIP)?"
fkip,"siapa saja dosen di fakultas fakultas Keguruan & ilmu Pendidikan (FKIP)?"
fkip,"apa visi dan misi fakultas Keguruan & ilmu Pendidikan (FKIP)"
fkip,"Apakah universitas klabat memiliki fakultas Keguruan & ilmu Pendidikan atau FKIP?"
fkip,"Tolong informasikan tentang fakultas Keguruan & ilmu Pendidikan atau FKIP di universitas klabat."
fkip,"Saya ingin tahu lebih banyak tentang fakultas Keguruan & ilmu Pendidikan atau FKIP di universitas klabat."
fkip,"Apakah ada informasi mengenai fakultas Keguruan & ilmu Pendidikan atau FKIP di universitas klabat?"
fkip,"Mohon berikan rincian tentang fakultas Keguruan & ilmu Pendidikan atau FKIP di universitas klabat."
fkip,"Bagaimana cara mendaftar ke fakultas Keguruan & ilmu Pendidikan atau FKIP di universitas klabat?"
fkip,"Siapa yang dapat memberikan informasi tentang fakultas Keguruan & ilmu Pendidikan atau FKIP di universitas klabat?"
fkip,"Bolehkah saya menanyakan tentang fakultas Keguruan & ilmu Pendidikan atau FKIP di universitas klabat?"
fkip,"Tolong berikan informasi terkait fakultas Keguruan & ilmu Pendidikan atau FKIP di universitas klabat."
fkip,"Saya ingin mengetahui program studi yang ada di fakultas Keguruan & ilmu Pendidikan atau FKIP di universitas klabat."
fkip,"Apakah universitas klabat memiliki informasi mengenai prospek karir lulusan fakultas Keguruan & ilmu Pendidikan atau FKIP?"
fkip,"Mohon berikan detail tentang fakultas Keguruan & ilmu Pendidikan atau FKIP di universitas klabat."
fkip,"Siapa yang bisa saya hubungi untuk mendapatkan informasi tentang fakultas Keguruan & ilmu Pendidikan atau FKIP di universitas klabat?"
fkip,"Apakah ada kontak yang bisa saya hubungi untuk menanyakan informasi fakultas Keguruan & ilmu Pendidikan atau FKIP di universitas klabat?"
fkip,"Bagaimana cara mendapatkan brosur atau informasi lebih lanjut tentang fakultas Keguruan & ilmu Pendidikan atau FKIP di universitas klabat?"
fkip,"Siapa dekan dari fakultas Keguruan & ilmu Pendidikan atau FKIP di universitas klabat?"
fkip,"Apakah ada beasiswa khusus untuk mahasiswa fakultas Keguruan & ilmu Pendidikan atau FKIP di universitas klabat?"
fkip,"Berapa lama masa studi dalam fakultas Keguruan & ilmu Pendidikan atau FKIP di universitas klabat?"
fkip,"Apakah ada kerja praktik atau magang yang diwajibkan dalam fakultas Keguruan & ilmu Pendidikan atau FKIP di universitas klabat?"
fkip,"apa visi dan misi dari fakultas keguruan?"
fkip,"apa visi dan misi dari fkip?"
fkip,"apakah benar adalah dekan fakultas keguruan?"
fkip,"apakah benar adalah dekan fakultas fkip?"
fakper,"fakultas pertanian?"
fakper,"apa kepanjangan dari fakper di unklab?"
fakper,"apa kepanjangan fakper?"
fakper,"apa itu fakultas pertanian?"
fakper,"ceritakan sedikit tentang fakultas pertanian?"
fakper,"latar belakang dari fakultas pertanian di unklab?"
fakper,"siapa dekan dari fakultas pertanian?"
fakper,"dekan di fakultas pertanian?"
fakper,"siapa dekan di fakultas pertanian?"
fakper,"dekan fakultas pertanian?"
fakper,"siapa dekan dari fakultas pertanian?"
fakper,"dekan di fakultas pertanian?"
fakper,"siapa saja dosen di fakultas pertanian?"
fakper,"apa visi dan misi fakultas pertanian?"
fakper,"Apakah universitas klabat memiliki fakultas Pertanian atau FakPer?"
fakper,"Tolong informasikan tentang fakultas Pertanian atau FakPer di universitas klabat."
fakper,"Saya ingin tahu lebih banyak tentang fakultas Pertanian atau FakPer di universitas klabat."
fakper,"Apakah ada informasi mengenai fakultas Pertanian atau FakPer di universitas klabat?"
fakper,"Mohon berikan rincian tentang fakultas Pertanian atau FakPer di universitas klabat."
fakper,"Bagaimana cara mendaftar ke fakultas Pertanian atau FakPer di universitas klabat?"
fakper,"Siapa yang dapat memberikan informasi tentang fakultas Pertanian atau FakPer di universitas klabat?"
fakper,"Bolehkah saya menanyakan tentang fakultas Pertanian atau FakPer di universitas klabat?"
fakper,"Tolong berikan informasi terkait fakultas Pertanian atau FakPer di universitas klabat."
fakper,"Saya ingin mengetahui program studi yang ada di fakultas Pertanian atau FakPer di universitas klabat."
fakper,"Apakah universitas klabat memiliki informasi mengenai prospek karir lulusan fakultas Pertanian atau FakPer?"
fakper,"Mohon berikan detail tentang fakultas Pertanian atau FakPer di universitas klabat."
fakper,"Siapa yang bisa saya hubungi untuk mendapatkan informasi tentang fakultas Pertanian atau FakPer di universitas klabat?"
fakper,"Apakah ada kontak yang bisa saya hubungi untuk menanyakan informasi fakultas Pertanian atau FakPer di universitas klabat?"
fakper,"Bagaimana cara mendapatkan brosur atau informasi lebih lanjut tentang fakultas Pertanian atau FakPer di universitas klabat?"
fakper,"Siapa dekan dari fakultas Pertanian atau FakPer di universitas klabat?"
fakper,"Apakah ada beasiswa khusus untuk mahasiswa fakultas Pertanian atau FakPer di universitas klabat?"
fakper,"Berapa lama masa studi dalam fakultas Pertanian atau FakPer di universitas klabat?"
fakper,"Apakah ada kerja praktik atau magang yang diwajibkan dalam fakultas Pertanian atau FakPer di universitas klabat?"
fakper,"apa visi dan misi dari fakultas pertanian?"
fakper,"apakah benar adalah dekan fakultas pertanian?"
fakper,"apakah benar adalah dekan FakPer?"
fkep,"apa kepanjangan dari fkep di unklab?"
fkep,"apa kepanjangan fkep?"
fkep,"fkep"
fkep,"fkep unklab"
fkep,"apa itu fkep?"
fkep,"fakultas keperawatan"
fkep,"apa itu fakultas keperawatan?"
fkep,"ceritakan sedikit tentang fkep?"
fkep,"latar belakang dari fakultas keperawatan?"
fkep,"siapa dekan dari fakultas keperawatan?"
fkep,"dekan dari fakultas keperawatan?"
fkep,"siapa dekan di fakultas keperawatan?"
fkep,"siapa dekan di fakultas keperawatan unklab?"
fkep,"siapa dekan di fakultas keperawatan universitas klabat?"
fkep,"dekan fakultas keperawatan?"
fkep,"dekan keperawatan?"
fkep,"info siapa ya dekan dari fakultas keperawatan?"
fkep,"apa visi dan misi dari fakultas keperawatan?"
fkep,"siapa saja dosen di fakultas keperawatan?"
fkep,"apa visi dan misi fakultas keperawatan"
fkep,"apa visi dan misi fkep"
fkep,"Apa yang dapat Anda ceritakan tentang fakultas Keperawatan di universitas klabat?"
fkep,"Tolong berikan informasi tentang program studi yang ditawarkan di fakultas Keperawatan universitas klabat."
fkep,"Bagaimana proses penerimaan mahasiswa baru di fakultas Keperawatan universitas klabat?"
fkep,"Siapa dekan fakultas Keperawatan di universitas klabat?"
fkep,"Apakah fakultas Keperawatan di universitas klabat memiliki laboratorium modern?"
fkep,"Apa saja kegiatan ekstrakurikuler yang ada di fakultas Keperawatan universitas klabat?"
fkep,"Apakah fakultas Keperawatan universitas klabat memiliki program magister atau doktor?"
fkep,"Dapatkah saya mendapatkan informasi tentang kurikulum yang digunakan di fakultas Keperawatan?"
fkep,"Apakah fakultas Keperawatan di universitas klabat memiliki beasiswa?"
fkep,"Bagaimana kualitas pengajaran di fakultas Keperawatan universitas klabat?"
fkep,"Apakah fakultas Keperawatan universitas klabat memiliki program pertukaran pelajar?"
fkep,"Apakah ada kesempatan berkarir di bidang keperawatan setelah lulus dari fakultas Keperawatan?"
fkep,"Bagaimana koneksi industri fakultas Keperawatan di universitas klabat?"
fkep,"Apakah fakultas Keperawatan universitas klabat menyelenggarakan seminar atau konferensi?"
fkep,"Apa saja fasilitas yang tersedia di fakultas Keperawatan universitas klabat?"
fkep,"Bagaimana reputasi fakultas Keperawatan universitas klabat di bidang keperawatan?"
fkep,"Apakah fakultas Keperawatan di universitas klabat memiliki program magang?"
fkep,"Berapa lama masa studi di fakultas Keperawatan universitas klabat?"
fkep,"Bagaimana sistem pembelajaran di fakultas Keperawatan universitas klabat?"
fkep,"Apakah fakultas Keperawatan universitas klabat memiliki program kerjasama internasional?"
fkep,"apakah benar adalah dekan fakultas Keperawatan?"
fkep,"apakah benar adalah dekan fkep?"
